{
  "$schema": "https://json-schema.org/draft/2020-12/schema",
  "$id": "https://licoarc.com/spec/protection-profiles.json",
  "registryVersion": "licoarc.protection-profiles.v1",
  "definitionStates": [
    "PENDING",
    "DRAFT",
    "PARTIAL",
    "COMPLETE"
  ],
  "lifecycleStates": [
    "Candidate"
  ],
  "profiles": [
    {
      "profileLocator": "stable-core",
      "generation": 1,
      "profileId": "abef93baec2b1a7ecdf67bb3783bc641c0c1be7f3696615462597f323e4b46b5",
      "lifecycle": "Candidate",
      "definitionStatus": "PARTIAL",
      "sessionEligible": false,
      "publicationEligible": false,
      "sourceDescriptorPath": "spec/v1/protection/profile.json",
      "requiredClaimIds": [
        "SEC-001",
        "SEC-002",
        "SEC-003",
        "SEC-004",
        "SEC-005",
        "SEC-006",
        "SEC-007",
        "SEC-008",
        "SEC-009",
        "SEC-010",
        "SEC-011",
        "SEC-012",
        "SEC-013",
        "SEC-020",
        "SEC-021",
        "SEC-022",
        "SEC-023"
      ],
      "stableNonClaimIds": [
        "ongoing-post-quantum-post-compromise-recovery",
        "physical-zeroization",
        "ratchet-header-confidentiality",
        "rollback-detection-under-fully-compromised-store"
      ],
      "blockers": [
        "SEC-proof-requalification"
      ]
    }
  ],
  "activeProfileIds": [],
  "contentIdentity": {
    "name": "ProtectionProfileSemanticProjectionV1",
    "algorithm": "SHA-256-over-domain-and-deterministic-CBOR",
    "include": [
      "profile-semantic-version",
      "indivisible-composition-rules",
      "canonical-semantic-source-bytes-excluding-authority-vectors",
      "stable-positive-claim-identifiers",
      "stable-nonclaim-identifiers"
    ],
    "exclude": [
      "profileId-and-contentIdentity",
      "catalogs-containing-identities",
      "lifecycle-and-publication",
      "admission-status",
      "proof-results-and-tools",
      "formal-bindings",
      "source-and-artifact-digests"
    ]
  },
  "admission": {
    "requires": "known-complete-content-identical-profile",
    "contentIdentity": "recomputed-before-active-admission",
    "claimClosure": "all-required-positive-claims-known-proved-and-fully-bound",
    "corpusClosure": "complete-declared-profile-corpus",
    "reducedSecurityFallback": "forbidden",
    "componentNegotiation": "forbidden",
    "unknownProfile": "terminal-unknown-profile",
    "identifierReuse": "forbidden",
    "stateAdvanceOnFailure": false
  }
}
